{
  "timestamp": "2026-07-30T10:58:55Z",
  "service": "beszel",
  "phase": "inventory",
  "status": "SUCCESS",
  "dry_run": false,
  "execute": true,
  "source": "",
  "destination": "/mnt/monarch/appdata/beszel",
  "files": 0,
  "directories": 0,
  "bytes": "0B",
  "bytes_raw": 0,
  "copy_required": "no",
  "compose_update_needed": "no",
  "compose_updated": false,
  "verification_status": "inventory_complete",
  "rollback_available": true,
  "rsync_excludes": "",
  "warnings": [],
  "errors": [],
  "warning_count": 0,
  "error_count": 0
}
