{
  "timestamp": "2026-07-30T09:28:13Z",
  "service": "homepage-images",
  "phase": "verify",
  "status": "SUCCESS",
  "dry_run": false,
  "execute": true,
  "source": "/hive/data/homepage/images",
  "destination": "/mnt/monarch/appdata/homepage/images",
  "files": 0,
  "directories": 1,
  "bytes": "0B",
  "bytes_raw": 0,
  "copy_required": "yes",
  "compose_update_needed": "yes",
  "compose_updated": false,
  "verification_status": "copy_verified",
  "rollback_available": true,
  "rsync_excludes": "",
  "warnings": [],
  "errors": [],
  "warning_count": 0,
  "error_count": 0
}
