{
  "timestamp": "2026-07-30T09:09:34Z",
  "service": "portainer",
  "phase": "preflight",
  "status": "SUCCESS",
  "dry_run": false,
  "execute": true,
  "source": "/hive/portainer",
  "destination": "/mnt/monarch/appdata/portainer",
  "files": 18,
  "directories": 19,
  "bytes": "2.6MB",
  "bytes_raw": 2628232,
  "copy_required": "yes",
  "compose_update_needed": "yes",
  "compose_updated": false,
  "verification_status": "preflight_ok",
  "rollback_available": true,
  "rsync_excludes": "compose/49,compose/50",
  "warnings": [
    "Partial tree stats: 4 permission-denied path(s) under /hive/portainer (size/count may be incomplete)",
    "git working tree not clean \u2014 EXPECTED while Phase 10.5 framework changes are uncommitted"
  ],
  "errors": [],
  "warning_count": 2,
  "error_count": 0
}
