{
  "timestamp": "2026-07-30T10:54:26Z",
  "service": "calibre-web",
  "phase": "preflight",
  "status": "SUCCESS",
  "dry_run": false,
  "execute": true,
  "source": "/hive/calibre-web/config",
  "destination": "/mnt/monarch/appdata/calibre-web",
  "files": 6,
  "directories": 1,
  "bytes": "333KB",
  "bytes_raw": 340210,
  "copy_required": "yes",
  "compose_update_needed": "yes",
  "compose_updated": false,
  "verification_status": "preflight_ok",
  "rollback_available": true,
  "rsync_excludes": "",
  "warnings": [
    "git working tree not clean \u2014 EXPECTED while Phase 10.5 framework changes are uncommitted"
  ],
  "errors": [],
  "warning_count": 1,
  "error_count": 0
}
