{
  "timestamp": "2026-07-30T12:19:14Z",
  "service": "hotio",
  "phase": "copy",
  "status": "SUCCESS",
  "dry_run": false,
  "execute": true,
  "source": "/hive/Hotio/config",
  "destination": "/mnt/monarch/appdata/hotio",
  "files": 851,
  "directories": 15,
  "bytes": "21MB",
  "bytes_raw": 21976711,
  "copy_required": "yes",
  "compose_update_needed": "yes",
  "compose_updated": true,
  "verification_status": "copy_complete",
  "rollback_available": true,
  "rsync_excludes": "",
  "warnings": [],
  "errors": [],
  "warning_count": 0,
  "error_count": 0
}
