{
  "timestamp": "2026-07-30T09:37:14Z",
  "service": "code-server",
  "phase": "verify",
  "status": "SUCCESS",
  "dry_run": false,
  "execute": true,
  "source": "/hive/code-server/config",
  "destination": "/mnt/monarch/appdata/code-server",
  "files": 41259,
  "directories": 6886,
  "bytes": "3.0GB",
  "bytes_raw": 3201824000,
  "copy_required": "yes",
  "compose_update_needed": "yes",
  "compose_updated": false,
  "verification_status": "copy_verified",
  "rollback_available": true,
  "rsync_excludes": "",
  "warnings": [],
  "errors": [],
  "warning_count": 0,
  "error_count": 0
}
