{
  "timestamp": "2026-07-30T12:09:35Z",
  "service": "nzbget",
  "phase": "verify",
  "status": "SUCCESS",
  "dry_run": true,
  "execute": false,
  "source": "/hive/NZBget/config",
  "destination": "/mnt/monarch/appdata/nzbget",
  "files": 0,
  "directories": 0,
  "bytes": "0B",
  "bytes_raw": 0,
  "copy_required": "yes",
  "compose_update_needed": "yes",
  "compose_updated": false,
  "verification_status": "pending_copy_dry_run",
  "rollback_available": true,
  "rsync_excludes": "downloads/**,*.log,nzbget.log",
  "warnings": [],
  "errors": [],
  "warning_count": 0,
  "error_count": 0
}
