{
  "timestamp": "2026-07-30T12:18:53Z",
  "service": "hotio",
  "phase": "preflight",
  "status": "SUCCESS",
  "dry_run": false,
  "execute": true,
  "source": "/hive/Hotio/config",
  "destination": "/mnt/monarch/appdata/hotio",
  "files": 854,
  "directories": 15,
  "bytes": "21MB",
  "bytes_raw": 21976540,
  "copy_required": "yes",
  "compose_update_needed": "yes",
  "compose_updated": true,
  "verification_status": "preflight_ok",
  "rollback_available": true,
  "rsync_excludes": "",
  "warnings": [
    "git working tree not clean \u2014 EXPECTED while Phase 10.5 framework changes are uncommitted"
  ],
  "errors": [],
  "warning_count": 1,
  "error_count": 0
}
