{
  "timestamp": "2026-07-30T09:10:10Z",
  "service": "portainer",
  "phase": "update-compose",
  "status": "SUCCESS",
  "dry_run": false,
  "execute": true,
  "source": "/hive/portainer",
  "destination": "/mnt/monarch/appdata/portainer",
  "files": 0,
  "directories": 0,
  "bytes": "0B",
  "bytes_raw": 0,
  "copy_required": "yes",
  "compose_update_needed": "yes",
  "compose_updated": true,
  "verification_status": "compose_applied",
  "rollback_available": true,
  "rsync_excludes": "compose/49,compose/50",
  "warnings": [],
  "errors": [],
  "warning_count": 0,
  "error_count": 0
}
