{
  "timestamp": "2026-07-30T10:52:13Z",
  "service": "calibre",
  "phase": "inventory",
  "status": "SUCCESS",
  "dry_run": false,
  "execute": true,
  "source": "/hive/calibre/config",
  "destination": "/mnt/monarch/appdata/calibre",
  "files": 312,
  "directories": 171,
  "bytes": "37MB",
  "bytes_raw": 38493102,
  "copy_required": "yes",
  "compose_update_needed": "yes",
  "compose_updated": false,
  "verification_status": "inventory_complete",
  "rollback_available": true,
  "rsync_excludes": "",
  "warnings": [],
  "errors": [],
  "warning_count": 0,
  "error_count": 0
}
