{
  "timestamp": "2026-07-30T10:54:51Z",
  "service": "calibre-web",
  "phase": "verify",
  "status": "SUCCESS",
  "dry_run": false,
  "execute": true,
  "source": "/hive/calibre-web/config",
  "destination": "/mnt/monarch/appdata/calibre-web",
  "files": 6,
  "directories": 1,
  "bytes": "335KB",
  "bytes_raw": 342331,
  "copy_required": "yes",
  "compose_update_needed": "yes",
  "compose_updated": false,
  "verification_status": "copy_verified",
  "rollback_available": true,
  "rsync_excludes": "",
  "warnings": [],
  "errors": [],
  "warning_count": 0,
  "error_count": 0
}
