{
  "timestamp": "2026-07-31T10:58:13Z",
  "service": "jellyfin",
  "phase": "preflight",
  "status": "SUCCESS",
  "dry_run": false,
  "execute": true,
  "source": "/hive/jellyfin/config",
  "destination": "/mnt/monarch/appdata/jellyfin",
  "files": 48141,
  "directories": 22723,
  "bytes": "11GB",
  "bytes_raw": 11083995242,
  "copy_required": "yes",
  "compose_update_needed": "yes",
  "compose_updated": true,
  "verification_status": "preflight_ok",
  "rollback_available": true,
  "rsync_excludes": "cache/**,data/transcodes/**,.temp/**,log/**",
  "warnings": [
    "git working tree not clean \u2014 EXPECTED while Phase 10.5 framework changes are uncommitted"
  ],
  "errors": [],
  "warning_count": 1,
  "error_count": 0
}
