{
  "timestamp": "2026-07-30T10:03:11Z",
  "service": "authentik",
  "phase": "verify-destination",
  "status": "SUCCESS",
  "dry_run": true,
  "execute": false,
  "source": "/hive/data/authentik",
  "destination": "/mnt/monarch/appdata/authentik",
  "files": 0,
  "directories": 0,
  "bytes": "0B",
  "bytes_raw": 0,
  "copy_required": "yes",
  "compose_update_needed": "yes",
  "compose_updated": false,
  "verification_status": "destination_ok",
  "rollback_available": true,
  "rsync_excludes": "",
  "warnings": [],
  "errors": [],
  "warning_count": 0,
  "error_count": 0
}
