{
  "timestamp": "2026-07-31T11:02:41Z",
  "service": "jellyfin",
  "phase": "verify",
  "status": "SUCCESS",
  "dry_run": false,
  "execute": true,
  "source": "/hive/jellyfin/config",
  "destination": "/mnt/monarch/appdata/jellyfin",
  "files": 0,
  "directories": 0,
  "bytes": "0B",
  "bytes_raw": 0,
  "copy_required": "yes",
  "compose_update_needed": "yes",
  "compose_updated": false,
  "verification_status": "smoke_complete",
  "rollback_available": true,
  "rsync_excludes": "cache/**,data/transcodes/**,.temp/**,log/**",
  "warnings": [],
  "errors": [],
  "warning_count": 0,
  "error_count": 0
}
